Ano do diploma;Tipo de diploma;N.º do diploma;Data do diploma;Título / âmbito do diploma;Link;;
2009;Decreto Regulamentar;3/2009;3 de fevereiro;Regulamenta o artigo 1.º da Lei n.º 19/2008, de 21 de Abril, que tem por objecto a criação no âmbito do Ministério da Justiça de uma base de dados de procurações;https://dre.pt/application/file/601619;;
2009;Decreto Regulamentar; 10/2009;29 de maio ;Fixa a cartografia a utilizar nos instrumentos de gestão territorial, bem como na representação de quaisquer condicionantes;https://dre.pt/application/file/494124;;
2009;Decreto Regulamentar;18/2009;4 de setembro;Adapta aos serviços da administração autárquica o sistema integrado de avaliação do desempenho na Administração Pública (SIADAP), aprovado pela Lei n.º 66-B/2007, de 28 de Dezembro, e revoga o Decreto Regulamentar n.º 6/2006, de 20 de Junho;https://dre.pt/pdf1sdip/2009/09/17200/0593505942.pdf;;
2009;Decreto Regulamentar; 28/2009;12 de outubro;Procede à terceira alteração ao Decreto Regulamentar n.º 61/94, que veio proceder à regulamentação do Decreto-Lei n.º 15/93 relativo ao controlo do tráfico ilícito de estupefacientes, de substâncias psicotrópicas e dos precursores e outros produtos químicos essenciais ao fabrico de droga.;https://dre.pt/application/file/491627;;
2009;Despacho;399/2009;7 de janeiro;Aprovação do Manual de Boas Práticas Laboratoriais de Anatomia Patológica (MBPLAP);https://dre.pt/application/file/a/2265745;;
2009;Despacho;6303-B/2009;25 de fevereiro;Mobilidade voluntária;https://dre.pt/application/file/2013848;;
2009;Despacho;11809/2009;15 de maio;Reclamações apresentadas junto das instituições de ensino superior;https://dre.pt/application/file/812279;;
2009;Despacho;12966/2009;2 de junho;Constituição de um núcleo para o braille e meios complementares de leitura;https://dre.pt/application/file/2513390;;
2009;Despacho Normativo;12/2009;17 de março;Fixa a natureza e os limites dos custos considerados elegíveis para efeitos de co-financiamento pelo FSE;https://dre.pt/application/file/2124131;;
2009;Diretiva Técnica UMCCI;3/2009;21 de setembro;Modelo de referenciação de utentes;http://www.acss.min-saude.pt/Portals/0/Diretiva%20T%C3%A9cnica%20n%C2%BA%203%20-%20UMCCI%20-%202009%20-%20Modelo%20de%20referencia%C3%A7%C3%A3o%20de%20utentes.pdf;;
2009;DL;6/2009;6 de janeiro;Estabelece o regime de colocação no mercado de pilhas e acumuladores e o regime de recolha, tratamento, reciclagem e eliminação dos resíduos de pilhas e de acumuladores, transpondo para a ordem jurídica interna a Diretiva n.º 2006/66/CE, do Parlamento Europeu e do Conselho, de 6 de Setembro, relativa a pilhas e acumuladores e respetivos resíduos e que revoga a Diretiva n.º 91/157/CEE, do Conselho, de 18 de Março, alterada pela Diretiva n.º 2008/12/CE, do Parlamento Europeu e do Conselho, de 11 de Março;https://dre.pt/application/file/396839;;
2009;DL;7/2009;6 de janeiro;Transpõe para a ordem jurídica interna a Diretiva n.º 2007/61/CE, do Conselho, de 26 de Setembro, que altera a Diretiva n.º 2001/114/CE, do Conselho, de 20 de Dezembro, relativa a determinados leites conservados parcial ou totalmente desidratados destinados à alimentação humana;https://dre.pt/application/file/396837;;
2009;DL;16/2009;14 de  janeiro;Aprova o regime jurídico dos planos de ordenamento, de gestão e de intervenção de âmbito florestal e revoga os Decretos-Leis n.os 204/99 e 205/99, ambos de 9 de Junho;https://dre.pt/application/file/397417;;
2009;DL;17/2009;14 de janeiro;Segunda alteração ao Decreto-Lei n.º 124/2006, de 28 de Junho, que estabelece as medidas e ações a desenvolver no âmbito do Sistema de Defesa da Floresta contra Incêndios, e revoga a Lei n.º 14/2004, de 8 de Maio;https://dre.pt/application/file/397418;;
2009;DL;107/2009;15 de maio;Aprova o regime de proteção das albufeiras de águas públicas de serviço público e das lagoas ou lagos de águas públicas;https://dre.pt/application/file/608623;;
2009;DL;42/2009;12 de fevereiro;Estabelece as competências das unidades da Polícia Judiciária e o regime remuneratório dos seus dirigentes;https://dre.pt/application/file/602196;;
2009;DL;68/2009;20 de março;Estabelece medidas de apoio aos desempregados de longa duração, actualizando o regime jurídico de proteção social na eventualidade de desemprego dos trabalhadores por conta de outrem, no âmbito do sistema previdencial, estabelecido no Decreto-Lei n.º 220/2006, de 3 de Novembro;https://dre.pt/application/file/605458;;
2009;DL;73/2009;31 de março;Aprova o regime jurídico da Reserva Agrícola Nacional e revoga o Decreto-Lei n.º 196/89, de 14 de Junho;https://dre.pt/application/file/603129;;
2009;DL;88/2009;9 de abril;Procede à quarta alteração ao Decreto-Lei n.º 290-D/99, de 2 de Agosto, que estabelece o regime jurídico dos documentos electrónicos e da assinatura digital, e à primeira alteração ao Decreto-Lei n.º 116-A/2006, de 16 de Junho, que cria o Sistema de Certificação Electrónica do Estado;http://dre.pt/pdf1sdip/2009/04/07000/0215902175.pdf;;
2009;DL;91/2009;9 de abril;Estabelece o regime jurídico de proteção social na parentalidade no âmbito do sistema previdencial e no subsistema de solidariedade e revoga o Decreto-Lei n.º 154/88, de 29 de Abril, e o Decreto-Lei n.º 105/2008, de 25 de Junho;https://dre.pt/application/file/604081;;
2009;DL;93/2009;16 de abril;Aprova o sistema de atribuição de produtos de apoio a pessoas com deficiência e a pessoas com incapacidade temporária;https://dre.pt/application/file/603804;;
2009;DL;103/2009;12 de maio;Cria uma linha de crédito extraordinária destinada à proteção da habitação própria permanente em situação de desemprego;https://dre.pt/application/file/608168;;
2009;DL;122/2009;21 de maio;implifica as comunicações dos cidadãos e das empresas ao Estado, procedendo à 20.ª alteração ao Código do Registo Predial, à alteração do Código do Imposto sobre o Valor Acrescentado, à 31.ª alteração ao Código do Registo Comercial, à alteração do Código do Imposto sobre o Rendimento das Pessoas Colectivas, à 9.ª alteração ao regime do Registo Nacional de Pessoas Colectivas, à 20.ª alteração ao Decreto-Lei n.º 322-A/2001, de 14 de Dezembro, à 20.ª alteração ao Regulamento Emolumentar dos Registos e do Notariado, à 5.ª alteração ao Decreto-Lei n.º 8-B/2002, de 15 de Janeiro, à 1.ª alteração ao Decreto-Lei n.º 129/2007, de 27 de Abril, à 1.ª alteração ao Decreto-Lei n.º 132/2007, de 27 de Abril, à 1.ª alteração ao Decreto-Lei n.º 263-A/2007, de 23 de Julho, à 1.ª alteração ao Decreto-Lei n.º 20/2008, de 31 de Janeiro, e à 9.ª alteração ao Decreto Regulamentar n.º 55/80, de 8 de Outubro;https://dre.pt/application/file/608776;;
2009;DL;123/2009;21 de maio;Define o regime jurídico da construção, do acesso e da instalação de redes e infra-estruturas de comunicações electrónicas;https://dre.pt/application/file/608777;;
2009;DL;135/2009;3 de junho;Estabelece o regime de identificação, gestão, monitorização e classificação da qualidade das águas balneares e de prestação de informação ao público sobre as mesmas, transpondo para a ordem jurídica interna a Diretiva n.º 2006/7/CE;https://dre.pt/application/file/494391;;
2009;DL;145/2009;16 de junho;Estabelece as regras a que devem obedecer a investigação, o fabrico, a comercialização, a entrada em serviço, a vigilância e a publicidade dos dispositivos médicos e respectivos acessórios e transpõe para a ordem jurídica interna a Diretiva n.º 2007/47/CE, do Parlamento Europeu e do Conselho, de 5 de Setembro;https://dre.pt/application/file/494696;;
2009;DL;184/2009;11 de agosto;Estabelece o regime jurídico aplicável ao exercício da actividade dos centros de atendimento médico-veterinários (CAMV) e os respectivos requisitos quanto a instalações, organização e funcionamento;https://dre.pt/application/file/493319;;
2009;DL;185/2009;12 de agosto;Transpõe para a ordem jurídica interna a Diretiva n.º 2006/46/CE, do Parlamento Europeu e do Conselho, de 14 de Junho, que altera a Diretiva n.º 78/660/CEE, do Conselho, relativa às contas anuais de certas formas de sociedades, a Diretiva n.º 83/349/CEE, do Conselho, relativa às contas consolidadas, a Diretiva n.º 86/635/CEE, do Conselho, relativa às contas anuais e às contas consolidadas dos bancos e outras instituições financeiras, e a Diretiva n.º 91/674/CEE, do Conselho, relativa às contas anuais e às contas consolidadas das empresas de seguros, e adopta medidas de simplificação e eliminação de actos no âmbito de operações de fusão e cisão, alterando o Código de Registo Predial, o Código das Sociedades Comerciais, o Código de Registo Comercial, o Estatuto dos Benefícios Fiscais, o Código dos Valores Mobiliários, o Estatuto da Ordem dos Revisores Oficiais de Contas, o Regulamento Emolumentar dos Registos e do Notariado, o Código da Insolvência e da Recuperação de Empresas e o Regulamento do Registo Automóvel;https://dre.pt/application/file/493344;;
2009;DL;205/2009;31 de agosto;Procede à alteração do Estatuto da Carreira Docente Universitária, aprovado pelo Decreto-Lei n.º 448/79, de 13 de Novembro;https://dre.pt/application/file/488423;;
2009;DL;207/2009;31 de agosto;Procede à alteração do Estatuto da Carreira do Pessoal Docente do Ensino Superior Politécnico, aprovado pelo Decreto-Lei n.º 185/81, de 1 de Julho;https://dre.pt/application/file/488428;;
2009;DL;209/2009;3 de setembro;Adaptação à administração autárquica do disposto na Lei 12 -A/2008, de 27 de Fevereiro, alterada pela Lei 64 -A/2008, de 31 de Dezembro;http://dre.pt/pdf1sdip/2009/09/17100/0586805872.pdf;;
2009;DL;211/2009;3 de setembro;Assegura a execução da Convenção sobre o Comércio Internacional das Espécies de Fauna e Flora Selvagens Ameaçadas de Extinção (CITES), do Regulamento (CE) n.º 338/97, do Conselho, de 9 de Dezembro de 1996, relativo à proteção de espécies da fauna e da flora selvagens através do controlo do seu comércio, e do Regulamento (CE) n.º 865/2006, da Comissão, de 4 de Maio, revogando o Decreto-Lei n.º 114/90, de 5 de Abril;https://dre.pt/application/file/489325;;
2009;DL;228/2009;14 de setembro;Procede à primeira alteração ao Decreto-Lei n.º 39/2008, de 7 de Março, que aprovou o regime jurídico da instalação, exploração e funcionamento dos empreendimentos turísticos;http://dre.pt/pdf1sdip/2009/09/17800/0628706306.pdf;;
2009;DL;230/2009;14 de setembro;Procede à segunda alteração ao Decreto-Lei n.º 74/2006, de 24 de Março, que aprova o regime jurídico dos graus e diplomas do ensino superior, e determina a desmaterialização de procedimentos relativos ao processo individual do estudante e à emissão dos documentos comprovativos da titularidade dos graus e diplomas, e simplifica o procedimento relativo à equiparação a bolseiro de docentes, investigadores e outros trabalhadores das instituições de ensino superior públicas;https://dre.pt/application/file/489911;;
2009;DL;250/2009;23 de setembro;Procede à regulamentação dos benefícios fiscais contratuais, condicionados e temporários, susceptíveis de concessão ao abrigo do disposto no n.º 4 do artigo 41.º do Estatuto dos Benefícios Fiscais, desenvolvendo o disposto no n.º 2 do artigo 22.º do Código Fiscal do Investimento.;https://dre.pt/application/file/490369;;
2009;DL;251/2009;23 de setembro;Regula o exercício da assistência religiosa nas Forças Armadas e nas forças de segurança;https://dre.pt/application/file/490359;;
2009;DL;252/2009;23 de setembro;Regula a assistência religiosa nos estabelecimentos prisionais dependentes do Ministério da Justiça e nos centros educativos;https://dre.pt/application/file/490353;;
2009;DL;253/2009;23 de setembro;Aprova o Regulamento da Assistência Espiritual e Religiosa no Serviço Nacional de Saúde;https://dre.pt/application/file/490364;;
2009;DL;255/2009;24 de setembro;Estabelece as normas de execução na ordem jurídica nacional do Regulamento (CE) n.º 1739/2005, da Comissão, de 21 de Outubro, relativo ao estabelecimento das condições de polícia sanitária aplicáveis à circulação de animais de circo e outros números com animais entre Estados membros, e aprova as normas de identificação, registo, circulação e proteção dos animais utilizados em circos, exposições itinerantes, números com animais e manifestações similares em território nacional;http://dre.pt/pdf1sdip/2009/09/18600/0684806852.pdf;;
2009;DL;258/2009;25 de setembro;No uso da autorização legislativa concedida pela Lei n.º 32/2009, de 9 de Julho, que determina a aplicação do Decreto-Lei n.º 123/2009, de 21 de Maio, às infra-estruturas aptas ao alojamento de redes de comunicações electrónicas detidas, geridas ou utilizadas pelas empresas de comunicações electrónicas, sujeitando-as ao regime de acesso aberto, procede à terceira alteração da Lei n.º 5/2004, de 10 de Fevereiro, e à primeira alteração do Decreto-Lei n.º 123/2009, de 21 de Maio;https://dre.pt/application/file/490613;;
2009;DL;260/2009;25 de setembro;Regula o regime jurídico do exercício e licenciamento das agências privadas de colocação e das empresas de trabalho temporário;https://dre.pt/application/file/490607;;
2009;DL;264/2009;28 de setembro;Segunda alteração ao Decreto-Lei n.º 151-A/2000, de 20 de Julho, que estabelece o regime aplicável ao licenciamento de redes e estações de radiocomunicações e à fiscalização da instalação das referidas estações e da utilização do espectro radioeléctrico, bem como a definição dos princípios aplicáveis às taxas radioeléctricas e à partilha de infra-estruturas de radiocomunicações;http://dre.pt/pdf1sdip/2009/09/18800/0697206982.pdf;;
2009;DL;267/2009;29 de setembro;Estabelece o regime jurídico da gestão de óleos alimentares usados;https://dre.pt/application/file/490640;;
2009;DL;268/2009;29 de setembro;Estabelece o regime do licenciamento dos recintos itinerantes e improvisados, bem como as normas técnicas e de segurança aplicáveis à instalação e funcionamento dos equipamentos de diversão instalados nesses recintos, e procede à terceira alteração do Decreto-Lei n.º 309/2002, de 16 de Dezembro, que regula a instalação e o financiamento de recintos de espetáculos, no âmbito das competências das câmaras municipais;http://dre.pt/pdf1sdip/2009/09/18900/0699907008.pdf;;
2009;DL;272/2009;1 de outubro;Estabelece as medidas específicas de apoio ao desenvolvimento do desporto de alto rendimento e procede à primeira alteração ao Decreto-Lei n.º 393-A/99, de 2 de Outubro, que regula os regimes especiais de acesso e ingresso no ensino superior;https://dre.pt/application/file/490995;;
2009;DL;286/2009;8 de outubro;Regula a assistência e o patrocínio judiciário aos bombeiros, nos processos judiciais em que sejam demandados ou demandantes, por factos ocorridos no âmbito do exercício de funções, nos termos do artigo 7.º do Decreto-Lei n.º 241/2007, de 21 de Junho;https://dre.pt/application/file/491065;;
2009;DL;290/2009;12 de outubro;Aprova o regime jurídico de concessão de apoio técnico e financeiro para o desenvolvimento das políticas de emprego e de apoio à qualificação das pessoas com deficiência e incapacidades e o regime de concessão de apoio técnico e financeiro aos centros de reabilitação profissional de gestão participada, às entidades de reabilitação, bem como a credenciação de centros de recursos do Instituto do Emprego e Formação Profissional, I. P., e a criação do Fórum para a Integração Profissional;https://dre.pt/application/file/491623;;
2009;DL;291/2009;12 de outubro;Procede à segunda alteração ao Decreto-Lei n.º 202/96, de 23 de Outubro, que estabelece o regime de avaliação de incapacidade das pessoas com deficiência para efeitos de acesso às medidas e benefícios previstos na lei;https://dre.pt/application/file/491624;;
2009;DL;315/2009;29 de outubro;Regime jurídico da detenção de animais perigosos e potencialmente perigosos enquanto animais de companhia;https://dre.pt/application/file/a/483342;;
2009;DL;141/2009;16 de dezembro;Estabelece o regime jurídico das instalações desportivas de uso público;https://dre.pt/application/file/494689;;
2009;DL ;42/2009;2 de dezembro;Estabelece as competências das unidades da Polícia Judiciária e o regime remuneratório dos seus dirigentes;https://dre.pt/application/file/602196;;
2009;Lei;7/2009;12 de fevereiro;Aprova a revisão do Código do Trabalho;https://dre.pt/application/file/602193;;
2009;Lei;46/2009;20 de fevereiro;Procede à sexta alteração ao Decreto-Lei 380/99, de 22 de Setembro, que estabelece o regime jurídico dos instrumentos de gestão territorial;http://dre.pt/pdf1sdip/2009/02/03600/0116801205.pdf;;
2009;Lei;9/2009;4 de março;Transpõe para a ordem jurídica interna a Diretiva n.º 2005/36/CE, do Parlamento e do Conselho, de 7 de Setembro, relativa ao reconhecimento das qualificações profissionais,;https://dre.pt/application/file/604699;;
2009;Lei; 11/2009;25 de março;Regime contraordenacional do Regulamento de Segurança de Barragens, aprovado pelo Decreto-Lei n.º 344/2007, de 15 de Outubro.;https://dre.pt/application/file/605442;;
2009;Lei; 12/2009;26 de março;Estabelece o regime jurídico da qualidade e segurança relativa à dádiva, colheita, análise, processamento, preservação, armazenamento, distribuição e aplicação de tecidos e células de origem humana, transpondo para a ordem jurídica interna as Diretivas n.os 2004/23/CE, do Parlamento Europeu e do Conselho, de 31 de Março, 2006/17/CE, da Comissão, de 8 de Fevereiro, e 2006/86/CE, da Comissão, de 24 de Outubro;https://dre.pt/application/file/603284;;
2009;Lei;21/2009;20 de maio;Revoga o Decreto n.º 35 106, de 6 de Novembro de 1945;https://dre.pt/application/file/608785;;
2009;Lei;31-A/2009;7 de julho;Lei de Defesa Nacional Nota: Esta Lei é rectificada pela Declaração de Rectificação n.º 52/2009, de 20 de Julho, na qual se pública a Lei Orgânica n.º 1-B/2009, de 7 de Julho;https://dre.pt/application/file/345267;;
2009;Lei;39/2009;30 de julho;Estabelece o regime jurídico do combate à violência, ao racismo, à xenofobia e à intolerância nos espetáculos desportivos, de forma a possibilitar a realização dos mesmos com segurança;https://dre.pt/application/file/493139;;
2009;Lei;49/2009;8 de agosto;Regula as condições de acesso e exercício das atividades de comércio e indústria de bens e tecnologias militares;https://dre.pt/application/file/493816;;
2009;Lei;78/2009;13 de agosto;Procede à oitava alteração ao Código da Estrada, permitindo o averbamento da habilitação legal para a condução de veículos da categoria A1 à carta de condução que habilita legalmente para a condução de veículos da categoria B;https://dre.pt/application/file/493335;;
2009;Lei;81/2009;21 de agosto;Institui um sistema de vigilância em saúde pública, que identifica situações de risco, recolhe, actualiza, analisa e divulga os dados relativos a doenças transmissíveis e outros riscos em saúde pública, bem como prepara planos de contingência face a situações de emergência ou tão graves como de calamidade pública;https://dre.pt/application/file/488239;;
2009;Lei;85/2009;27 de agosto;Estabelece o regime da escolaridade obrigatória para as crianças e jovens que se encontram em idade escolar ;https://dre.pt/application/file/488764;;
2009;Lei;86/2009;28 de agosto;Autoriza o Governo a estabelecer o regime jurídico da estrutura e organização dos serviços da administração autárquica, revogando o Decreto-Lei n.º 116/84, de 6 de Abril;https://dre.pt/pdf1sdip/2009/08/16700/0568805689.pdf;;
2009;Lei;98/2009;4 de setembro;Regulamenta o regime de reparação de acidentes de trabalho e de doenças profissionais, incluindo a reabilitação e reintegração profissionais, nos termos do artigo 284.º do Código do Trabalho, aprovado pela Lei n.º 7/2009, de 12 de Fevereiro;https://dre.pt/application/file/489343;;
2009;Lei;102/2009;10 de setembro;Regime jurídico da promoção da segurança e saúde no trabalho;http://dre.pt/pdf1sdip/2009/09/17600/0616706192.pdf;;
2009;Lei;103/2009;11 de setembro;Aprova o regime jurídico do apadrinhamento civil, procedendo à alteração do Código do Registo Civil, do Código do Imposto sobre o Rendimento das Pessoas Singulares, da Lei de Organização e Funcionamento dos Tribunais Judiciais e do Código Civil;https://dre.pt/application/file/489875;;
2009;Lei;104/2009;14 de setembro;Aprova o regime de concessão de indemnização às vítimas de crimes violentos e de violência doméstica;https://dre.pt/application/file/489895;;
2009;Lei;112/2009;16 de setembro;Estabelece o regime jurídico aplicável à prevenção da violência doméstica, à proteção e à assistência das suas vítimas e revoga a Lei n.º 107/99, de 3 de Agosto, e o Decreto-Lei n.º 323/2000, de 19 de Dezembro;https://dre.pt/application/file/490285;;
2009;Lei;115/2009;12 de outubro;"Código da Execução das penas e medidas privativas da liberdade
";https://dre.pt/application/file/491628;;
2009;Lei Orgânica;1-A/2009;7 de julho;Lei Orgânica de Bases da Organização das Forças Armadas repúblicada pela Lei Orgânica 6/2014#;https://dre.pt/application/file/345266;;
2009;Lei Orgânica;Feb-09;22 de julho;Aprova o Regulamento de Disciplina Militar;https://dre.pt/application/file/a/493276;;
2009;Norma Operacional Permanente;3101/2009;4 de junho;Classificação de ocorrências (Existe a NOP 3101/2013 documento RESERVADO em vigor a partir de 5 de março);http://www.bombeiros.pt/Arquivo1/NOP's/NOP%203101-2009%20-%20Classifica%E7%E3o%20de%20Ocorr%EAncias.pdf;;
2009;Portaria;62/2009;22 de janeiro;Aprova os modelos de termos de aceitação da nomeação e de termo de posse;https://dre.pt/application/file/602644;;
2009;Portaria;64/2009;22 de janeiro;Estabelece o regime de credenciação de entidades para a emissão de pareceres, realização de vistorias e de inspecções das condições de segurança contra incêndios em edifícios (SCIE);https://dre.pt/application/file/602637;;
2009;Portaria;83-A/2009;22 de janeiro;Regulamenta a tramitação do procedimento concursal nos termos do n.º 2 do artigo 54.º da Lei n.º 12-A/2008, de 27 de Fevereiro (LVCR);https://dre.pt/application/file/624315;;
2009;Portaria;128/2009;30 de janeiro;Regula as medidas «Contrato emprego-inserção» e «Contrato emprego-inserção+»;https://dre.pt/application/file/601667;;
2009;Portaria;230-A/2009;27 de fevereiro;Altera a ficha técnica dos certificados de aforro - série C, constante da Portaria n.º 73-A/2008, de 23 de Janeiro;https://dre.pt/application/file/260676;;
2009;Portaria;307/2009;25 de março;Estabelece o regime do registo de procurações e respetivas extinções e os termos em que se processa a circulação electrónica de dados e documentos;https://dre.pt/application/file/605439;;
2009;Portaria;420/2009;20 de abril;Procede à revisão das categorias de bens e serviços cujos acordos quadro e procedimentos de contratação da aquisição são celebrados e conduzidos pela Agência Nacional de Compras Públicas, E. P. E. (ANCP);https://dre.pt/application/file/603788;;
2009;Portaria;569/2009;28 de maio;Cria o curso de pós-licenciatura de especialização em Enfermagem de Saúde Infantil e Pediatria na Escola Superior de Saúde do Instituto Politécnico de Beja e aprova o respectivo plano de estudos;https://dre.pt/application/file/494155;;
2009;Portaria;609/2009;5 de junho;Aprova o modelo de registo de trabalho extraordinário e os elementos que deve conter;https://dre.pt/application/file/494163;;
2009;Portaria;596/2009;3 de junho;Aprova o Regulamento de Aplicação da Medida n.º 4.1, «Cooperação para a Inovação», integrada no subprograma n.º 4, «Promoção do conhecimento e desenvolvimento de competências», do Programa de Desenvolvimento Rural do Continente - PRODER;https://dre.pt/application/file/494383;;
2009;Portaria;631/2009;9 de junho;Estabelece as normas regulamentares a que obedece a gestão dos efluentes das atividades pecuárias e as normas regulamentares relativas ao armazenamento, transporte e valorização de outros fertilizantes orgânicos;https://dre.pt/application/file/494463;;
2009;Portaria;634/2009;9 de junho;Estabelece as normas regulamentares aplicáveis à actividade de detenção e produção pecuária ou atividades complementares de equídeos;https://dre.pt/application/file/494466;;
2009;Portaria;635/2009;9 de junho;Estabelece as normas regulamentares aplicáveis à actividade de detenção e produção pecuária ou atividades complementares de animais da família Leporidae (coelhos e lebres);https://dre.pt/application/file/494467;;
2009;Portaria;636/2009;9 de junho;Estabelece as normas regulamentares aplicáveis à actividade de detenção e produção pecuária ou atividades complementares de animais da espécie suína;https://dre.pt/application/file/494468;;
2009;Portaria;637/2009;9 de junho;Estabelece as normas regulamentares aplicáveis à actividade de detenção e produção pecuária ou atividades complementares de animais de espécies avícolas;https://dre.pt/application/file/494453;;
2009;Portaria;676/2009;23 de junho;Substitui a tabela n.º 3 do anexo à Portaria n.º 80/2006, de 23 de Janeiro, que fixa os limiares mássicos máximos e mínimos de poluentes atmosféricos;https://dre.pt/application/file/494731;;
2009;Portaria;677/2009;23 de junho;Fixa os valores limite de emissão (VLE) aplicáveis às instalações de combustão abrangidas pelo Decreto-Lei n.º 78/2004;https://dre.pt/application/file/494734;;
