Ano do diploma;Tipo de diploma;N.º do diploma;Data do diploma;Título / âmbito do diploma;Link;;
2004;DL;2/2004;2 de janeiro;Aprova o Regulamento Técnico da Produção e Comercialização de Sementes de Espécies Oleaginosas e Fibrosas, destinadas a produção agrícola, com exclusão da utilização para fins ornamentais, transpondo para a ordem jurídica nacional a Diretiva n.º 2002/57/CE, do Conselho, de 13 de Junho, relativa à comercialização de sementes de espécies oleaginosas e fibrosas, com a redação que lhe foi dada pelas Diretivas n.os 2002/68/CE, do Conselho, de 19 de Julho, e 2003/45/CE, da Comissão, de 28 de Maio;https://dre.pt/application/file/240315;;
2004;DL;3/2004;3 de janeiro;Estabelece o regime jurídico a que fica sujeito o licenciamento da instalação e da exploração dos centros integrados de recuperação, valorização e eliminação de resíduos perigosos (CIRVER);https://dre.pt/application/file/240303;;
2004;DL; 12/2004;9 de janeiro;Estabelece o regime jurídico de ingresso e permanência na actividade da construção;https://dre.pt/application/file/241107;;
2004;DL;26/2004;4 de fevereiro;No uso da autorização legislativa concedida pela Lei n.º 49/2003, de 22 de Agosto, aprova o Estatuto do Notariado;https://dre.pt/application/file/592269;;
2004;DL;38/2004;27 de fevereiro;Altera as datas limite de utilização dos empréstimos contraídos ao abrigo da linha de crédito criada pelo Decreto-Lei n.º 306/2003, de 9 de Dezembro;https://dre.pt/application/file/568247;;
2004;DL;47/2004;3 de março;Define o regime geral das incorporações da documentação de valor permanente em arquivos públicos;https://dre.pt/application/file/551682;;
2004;DL;53/2004;18 de março;No uso da autorização legislativa concedida pela Lei n.º 39/2003, de 22 de Agosto, aprova o Código da Insolvência e da Recuperação de Empresas;https://dre.pt/application/file/538358;;
2004;DL;68/2004;25 de março;Estabelece os requisitos a que obedecem a publicidade e a informação disponibilizadas aos consumidores no âmbito da aquisição de imóveis para habitação;https://dre.pt/application/file/211086;;
2004;DL;78/2004;3 de abril;Estabelece o regime da prevenção e controlo das emissões de poluentes para a atmosfera, fixando os princípios, objectivos e instrumentos apropriados à garantia da proteção do recurso natural ar,;https://dre.pt/application/file/218379;;
2004;DL;108/2004;11 de maio;Altera o Decreto-Lei n.º 83/2000, de 11 de Maio, que aprova o regime legal da concessão e emissão de passaportes;https://dre.pt/application/file/264263;;
2004;DL;142/2004;11 de junho;Aprova o regime jurídico da actividade termal;https://dre.pt/application/file/286010;;
2004;DL;144/2004;15 de junho;Aprova a articulação entre as diversas entidades nacionais para execução das tarefas decorrentes da participação no programa previsto no n.º 2 do artigo 16.º da Diretiva n.º98/8/CE, do Parlamento Europeu e do Conselho, de 16 de Fevereiro;https://dre.pt/application/file/287716;;
2004;DL;165/2004;6 de julho;Altera o artigo 29.º do Decreto-Lei n.º 290-D/99, de 2 de Agosto, que aprova o regime jurídico dos documentos electrónicos e da assinatura digital, na redação que lhe foi dada pelo Decreto-Lei n.º 62/2003, de 3 de Abril;https://dre.pt/application/file/517312;;
2004;DL;201/2004;18 de agosto;Altera o Decreto-Lei n.º 316/98, de 20 de Outubro, que institui o procedimento extrajudicial de conciliação para viabilização de empresas em situação de insolvência ou em situação económica difícil;https://dre.pt/application/file/480648;;
2004;DL;202/2004;18 de agosto;Estabelece o regime jurídico da conservação, fomento e exploração dos recursos cinegéticos, com vista à sua gestão sustentável, bem como os princípios reguladores da actividade cinegética;http://dre.pt/pdf1sdip/2004/08/194A00/53185351.pdf;;
2004;DL;212/2004;23 de agosto;Estabelece a organização institucional do sector vitivinícola;https://dre.pt/application/file/479716;;
2004;Lei; 2/2004;15 de janeiro;Aprova o estatuto do pessoal dirigente dos serviços e organismos da administração central, regional e local do Estado;https://dre.pt/application/file/603296;;
2004;Lei;3/2004;15 de janeiro;Aprova a lei quadro dos institutos públicos;https://dre.pt/application/file/603298;;
2004;Lei;4/2004;15 de janeiro;Estabelece os princípios e normas a que deve obedecer a organização da administração direta do Estado;https://dre.pt/application/file/603295;;
2004;Lei;5/2004;10 de fevereiro;Lei das Comunicações Electrónicas;https://dre.pt/application/file/581093;;
2004;Lei;19/2004;20 de maio;Revisão da lei quadro que define o regime e forma de criação das polícias municipais;http://dre.pt/pdf1sdip/2004/05/118A00/31523155.pdf;;
2004;Lei;23/2004;22 de junho;Aprova o regime jurídico do contrato individual de trabalho da Administração Pública;https://dre.pt/application/file/271940;;
2004;Lei;26/2004;8 de julho;Aprova o Estatuto do Mecenato Científico e procede à nona alteração do Decreto-Lei n.º 74/99, de 16 de Março (Estatuto do Mecenato);https://dre.pt/application/file/517278;;
2004;Lei;31/2004;22 de julho;Adapta a legislação penal portuguesa ao Estatuto do Tribunal Penal Internacional, tipificando as condutas que constituem crimes de violação do direito internacional humanitário - 17.ª alteração ao Código Penal;https://dre.pt/application/file/507476;;
2004;Lei;34/2004;29 de julho;Altera o regime de acesso ao direito e aos tribunais e transpõe para a ordem jurídica nacional a Diretiva n.º 2003/8/CE, do Conselho, de 27 de Janeiro, relativa à melhoria do acesso à justiça nos litígios transfronteiriços através do estabelecimento de regras mínimas comuns relativas ao apoio judiciário no âmbito desses litígios;https://dre.pt/application/file/502332;;
2004;Lei;35/2004;29 de julho;Regulamenta a Lei n.º 99/2003, de 27 de Agosto, que aprovou o Código do Trabalho;https://dre.pt/application/file/502337;;
2004;Lei;40/2004;18 de agosto;Estatuto do Bolseiro de Investigação;https://dre.pt/application/file/480646;;
2004;Lei;41/2004;18 de agosto;Transpõe para a ordem jurídica nacional a Diretiva n.º 2002/58/CE, do Parlamento Europeu e do Conselho, de 12 de Julho, relativa ao tratamento de dados pessoais e à proteção da privacidade no sector das comunicações electrónicas;https://dre.pt/application/file/480651;;
2004;Lei;45/2004;19 de agosto;Estabelece o regime jurídico das perícias médico-legais e forenses;https://dre.pt/application/file/480460;;
2004;Lei;47/2004;19 de agosto;Aprova a Lei Quadro dos Museus Portugueses;https://dre.pt/application/file/480457;;
2004;n/a;s/nº;;"Concordata entre a Santa Sé e a República Portuguesa - 2004
";http://www.educris.com/v2/123-geral/927-concordata-entre-a-santa-se-e-a-república-portuguesa---2004;;
2004;Portaria;209/2004;3 de março;Aprova a Lista Europeia de Resíduos;https://dre.pt/application/file/551687;;
2004;Portaria;303-A/2004;22 de março;Introduz restrições de operação relacionadas com o ruído, adequadas ao objectivo ambiental estabelecido para o Aeroporto de Lisboa;https://dre.pt/application/file/644592;;
2004;Portaria;421/2004;24 de abril;Aprova o Regulamento de Registo, Classificação e Licenciamento de Cães e Gatos. Revoga a Portaria n.º 1427/2001, de 15 de Dezembro;https://dre.pt/application/file/222942;;
2004;Regulamento (CE); 273/2004;11 de fevereiro;Relativo aos precursores de drogas: Medidas para o controlo e a fiscalização de substâncias frequentemente utilizadas no fabrico ilegal de estupefacientes ou de substâncias psicotrópicas;http://eur-lex.europa.eu/legal-content/PT/TXT/?uri=URISERV%3Al33215;;
2004;Regulamento (CE);883/2004;29 de abril;Rectificação ao Regulamento (CE) n.o 883/2004 do Parlamento Europeue do Conselho, de 29 de Abril de 2004, relativo à coordenação dos sistemas de segurança social;http://eur-lex.europa.eu/legal-content/PT/TXT/PDF/?uri=CELEX:32004R0883R(01)&from=PT;;
2004;RCM;53/2004;21 de abril;Aprova a operacionalização da reforma da Administração Pública, áreas de actuação e metodologias de aplicação;https://dre.pt/application/file/223322;;
2005;Circular Normativa DGS;08/2005;21 de dezembro;Programa Nacional de Vacinação 2006.mOrientações Técnicas 08/DT/2005.;https://www.dgs.pt/upload/membro.id/ficheiros/i007442.pdf;;
2005;Deliberação do Conselho Superior dos Tribunais Administrativos e Fiscais;825/2005;16 de junho;Por deliberação do Conselho Superior dos Tribunais Administrativos e Fiscais de 30 de Maio de 2005, rectificada por despacho de 1 de Junho de 2005, são reformulados os critérios de classificação das espécies de processos;https://dre.pt/application/file/3341180;;
2005;DL;44/2005;23 de fevereiro;Altera o Código da Estrada, aprovado pelo Decreto-Lei n.º 114/94, de 3 de Maio;https://dre.pt/application/file/608662;;
2005;DL;49/2005;24 de fevereiro;Primeira alteração ao Decreto-Lei n.º 140/99, de 24 de Abril, que procedeu à transposição para a ordem jurídica interna da Diretiva n.º 79/409/CEE, do Conselho, de 2 de Abril, relativa à conservação das aves selvagens (Diretiva aves) e da Diretiva n.º 92/43/CEE, do Conselho, de 21 de Maio, relativa à preservação dos habitats naturais e da fauna e da flora selvagens (Diretiva habitats);https://dre.pt/application/file/608095;;
2005;DL;50/2005;25 de fevereiro;Transpõe para a ordem jurídica interna a Diretiva n.º 2001/45/CE, do Parlamento Europeu e do Conselho, de 27 de Junho, relativa às prescrições mínimas de segurança e de saúde para a utilização pelos trabalhadores de equipamentos de trabalho;https://dre.pt/application/file/584329;;
2005;DL;67/2005;15 de março;Regula o reconhecimento pelo Estado Português dos graus académicos conferidos na sequência da conclusão com êxito de um curso de mestrado «Erasmus Mundus» e a sua titulação;https://dre.pt/pdf1sdip/2005/03/052A00/22652266.pdf;;
2005;DL;111/2005;8 de julho;Cria a «empresa na hora», através de um regime especial de constituição imediata de sociedades, alterando o Código das Sociedades Comerciais, o regime do Registo Nacional das Pessoas Colectivas, o Código do Registo Comercial, o Decreto-Lei n.º 322-A/2001, de 14 de Dezembro, o Regulamento Emolumentar dos Registos e Notariado, o Decreto-Lei n.º 8-B/2002, de 15 de Janeiro, o Código do Imposto sobre o Rendimento das Pessoas Colectivas e o Código do Imposto sobre o Valor Acrescentado;https://dre.pt/application/file/235844;;
2005;DL;133/2005;16 de agosto;Aprova o regime de licenciamento da actividade das entidades que operam no sector da pesquisa, captação e montagem de equipamentos de extração de água subterrânea;https://dre.pt/application/file/243614;;
2005;DL;140/2005;17 de agosto ;Estabelece os valores de dispensa de declaração do exercício de práticas que impliquem risco resultante das radiações ionizantes e, bem assim, os valores de dispensa de autorização prévia para o exercício das mesmas actividades, transpondo as correspondentes disposições da Diretiva n.º 96/29/EURATOM, do Conselho, de 13 de Maio;https://dre.pt/application/file/243418;;
2005;DL;146/2005;26 de agosto;Altera o Decreto-Lei n.º 28/2004, de 4 de Fevereiro, que estabelece o novo regime jurídico de proteção social na eventualidade doença no âmbito do subsistema previdencial de segurança social;https://dre.pt/application/file/245205;;
2005;DL;152/2005; 31 de agosto;Regula a aplicação na ordem jurídica interna do artigo 16.º e do n.º 1 do artigo 17.º do Regulamento (CE) n.º 2037/2000,;https://dre.pt/application/file/248383;;
2005;DL;167/2005;23 de setembro ;Estabelece o regime jurídico da assistência na doença aos militares das Forças Armadas;https://dre.pt/application/file/147919;;
2005;DL;156/2005;15 de setembro;Estabelece a obrigatoriedade de disponibilização do livro de reclamações a todos os fornecedores de bens ou prestadores de serviços que tenham contacto com o público em geral;https://dre.pt/application/file/143386;;
2005;DL;178-A/2005;28 de outubro;Aprova o documento único automóvel, mediante a criação do certificado de matrícula, transpondo para a ordem jurídica nacional a Diretiva n.º 1999/37/CE, do Conselho, de 29 de Abril, com a redação dada pela Diretiva n.º 2003/127/CE, da Comissão, de 23 de Dezembro, relativa aos documentos de matrícula dos veículos;https://dre.pt/application/file/404424;;
2005;DL;201/2005;24 de novembro;Altera o Decreto-Lei n.º 202/2004, de 18 de Agosto, que regulamenta a Lei n.º 173/99, de 21 de Setembro, Lei de Bases Gerais da Caça;https://dre.pt/application/file/481438;;
2005;DL;207/2005;29 de novembro;Regula os procedimentos previstos no artigo 23.º da Lei n.º 39-A/2005, de 29 de Julho, quanto à instalação de sistemas de vigilância rodoviária e ao tratamento da informação;https://dre.pt/application/file/483330;;
2005;DL;234/2005;30 de dezembro;Procede à terceira alteração do Decreto-Lei n.º 118/83, de 25 de Fevereiro, que estabelece o funcionamento e o esquema de benefícios da Direcção-Geral de Proteção Social aos Funcionários e Agentes da Administração Pública (ADSE);https://dre.pt/application/file/473445;;
2005;Lei;1/2005;10 de janeiro;Regula a utilização de câmaras de vídeo pelas forças e serviços de segurança em locais públicos de utilização comum;http://dre.pt/pdf1sdip/2005/01/006A00/02050208.pdf;;
2005;Lei;5-A/2005;11 de janeiro;Primeira alteração à Lei 169/99, de 18 de Setembro, que estabelece o quadro de competências, assim como o regime jurídico de funcionamento, dos órgãos dos municípios e das freguesias;http://dre.pt/pdf1sdip/2002/01/009A01/00020032.pdf;;
2005;Lei;12/2005;26 de janeiro;Informação genética pessoal e informação de saúde;https://dre.pt/application/file/624477;;
2005;Lei;13/2005;26 de janeiro;Primeira alteração ao Decreto-Lei n.º 108/2004, de 11 de Maio (altera o Decreto-Lei n.º 83/2000, de 11 de Maio, que aprova o regime legal da concessão e emissão de passaportes);https://dre.pt/application/file/624370;;
2005;Lei;49/2005; 30 de agosto;Segunda alteração à Lei de Bases do Sistema Educativo e primeira alteração à Lei de Bases do Financiamento do Ensino Superior;https://dre.pt/application/file/245260;;
2005;Lei;51/2005;30 de agosto;Estabelece regras para as nomeações dos altos cargos dirigentes da Administração Pública;https://dre.pt/application/file/245259;;
2005;Lei; 54/2005;15 de novembro;Estabelece a titularidade dos recursos hídricos;https://dre.pt/application/file/583915;;
2005;Lei;58/2005;29 de dezembro;Aprova a Lei da Água, transpondo para a ordem jurídica nacional a Diretiva n.º 2000/60/CE, do Parlamento Europeu e do Conselho, de 23 de Outubro, e estabelecendo as bases e o quadro institucional para a gestão sustentável das águas;http://dre.pt/pdf1sdip/2005/12/249A00/72807310.pdf;;
2005;Lei Constitucional;1/2005;12 de agosto;Sétima revisão constitucional;https://dre.pt/pdf1sdip/2005/08/155A00/46424686.pdf;;
2005;Lei Orgânica;4/2005;8 de setembro;rocede à primeira alteração à Lei Orgânica n.º 15-A/98, de 3 de Abril, flexibilizando os mecanismos de realização de referendos, à segunda alteração à Lei n.º 13/99, de 22 de Março, e à décima sexta alteração ao Decreto-Lei n.º 319-A/76, de 3 de Maio;https://dre.pt/application/file/142588;;
2005;Lei Orgânica;5/2005;8 de setembro;Décima sétima alteração ao regime jurídico da eleição do Presidente da República e terceira alteração ao regime jurídico do recenseamento eleitoral;https://dre.pt/application/file/142587;;
2005;NP EN ISO/IEC; 17025/2005;;Especifica os requisitos gerais de competência para laboratórios de ensaio e calibração, incluindo amostras.;http://www.iso.org/iso/catalogue_detail.htm?csnumber=39883;;
2005;Portaria;256/2005;16 de março;Aprova a atualização da Classificação Nacional das Áreas de Educação e Formação (CNAEF). Revoga a Portaria n.º 316/2001, de 2 de Abril;https://dre.pt/application/file/572804;;
2005;Portaria;263/2005;17 de março;Fixa novas regras para o cálculo da altura de chaminés e define as situações em que devem para esse efeito ser realizados estudos de poluentes atmosféricos;https://dre.pt/application/file/574395;;
2005;Portaria;85/2005;28 de abril;Estabelece o regime legal da incineração e co-incineração de resíduos, transpondo para a ordem jurídica interna a Diretiva n.º 2000/76/CE,;https://dre.pt/application/file/532733;;
2005;Portaria;961/2005;22 de setembro;Ministérios das Finanças e da Administração Pública, do Ambiente, do Ordenamento do Território e do Desenvolvimento Regional e da Agricultura, do Desenvolvimento Rural e das Pescas.;https://dre.pt/application/file/1895150;;
2005;Portaria;1135-B/2005;31 de outubro;Aprova o modelo de certificado de matrícula;https://dre.pt/application/file/143651;;
2005;Portaria; 1141/2005;8 de novembro;Define e regulamenta os cursos específicos para alta direcção em Administração Pública, ;https://dre.pt/application/file/583138;;
2005;Regulamento (CE);111/2005;22 de dezembro;Regras de controlo do comércio de precursores de drogas entre a Comunidade e países terceiros.;http://eur-lex.europa.eu/legal-content/PT/TXT/PDF/?uri=CELEX:32005R0111&from=PT;;
2005;RCM;124/2005;4 de agosto;Determina a reestruturação da administração central do Estado, estabelecendo os seus objectivos, princípios, programas e metodologia;https://dre.pt/application/file/240538;;
2006;Despacho;484/2006;9 de janeiro;"qualidade do sistema do ensino superior num quadro
que garanta a sua integração no actual contexto europeu, assim como
a qualificação dos Portugueses no espaço europeu.";https://dre.pt/application/file/2108986;;
2006;Despacho Normativo;28/2006;3 de maio;Aprova o Regulamento das Condições de Organização, Instalação e Funcionamento das Estruturas Residenciais para Pessoas com Deficiência;http://dre.pt/pdf1sdip/2006/05/085B00/32173222.pdf;;
2006;Despacho conjunto;275/2006;22 de março;Determina a observação, nos estabelecimentos militares de ensino Colégio Militar, Instituto Militar dos Pupilos do Exército e Instituto de Odivelas, são observadas as normas relativas à avaliação das aprendizagens definidas pelo Ministério da Educação para a generalidade dos estabelecimentos de ensino oficial e, ainda, as condições constantes do presente despacho visando a aprovação e transição de ano no âmbito de cada um dos estabelecimentos militares de ensino.;;;
2006;DL; 24/2006;6 de fevereiro;Altera o Decreto-Lei n.º 74/2004, de 26 de Março, que estabelece os princípios orientadores da organização e da gestão curricular, bem como da avaliação das aprendizagens, no nível secundário de educação;https://dre.pt/application/file/551908;;
2006;DL; 32/2006;15 de fevereiro;Estabelece novos limites máximos de resíduos de substâncias activas de produtos fitofarmacêuticos permitidos nos produtos agrícolas de origem vegetal, transpondo para a ordem jurídica nacional as Diretivas n.os 2004/95/CE, da Comissão, de 24 de Setembro, 2004/115/CE, da Comissão, de 15 de Dezembro, 2005/37/CE, da Comissão, de 3 de Junho, e 2005/46/CE, da Comissão, de 8 de Julho, na parte respeitante aos produtos agrícolas de origem vegetal;https://dre.pt/application/file/683932;;
2006;DL;74/2006;24 de março;Aprova o regime jurídico dos graus e diplomas do ensino superior, em desenvolvimento do disposto nos artigos 13.º a 15.º da Lei n.º 46/86, de 14 de Outubro (Lei de Bases do Sistema Educativo), bem como o disposto no n.º 4 do artigo 16.º da Lei n.º 37/2003, de 22 de Agosto (estabelece as bases do financiamento do ensino superior);https://dre.pt/application/file/671482;;
2006;DL;76-A/2006;29 de março;Actualiza e flexibiliza os modelos de governo das sociedades anónimas, adopta medidas de simplificação e eliminação de actos e procedimentos notariais e registrais e aprova o novo regime jurídico da dissolução e da liquidação de entidades comerciais;https://dre.pt/pdf1sdip/2006/03/063A01/00020190.pdf;;
2006;DL;77/2006;30 de março;Complementa a transposição da Diretiva n.º 2000/60/CE, do Parlamento Europeu e do Conselho, de 23 de outubro, que estabelece um quadro de ação comunitária no domínio da política da água;https://dre.pt/application/file/672239;;
2006;DL;79/2006;4 de abril;Aprova o Regulamento dos Sistemas Energéticos de Climatização em Edifícios;https://dre.pt/application/file/672553;;
2006;DL;80/2006;4 de abril;Aprova o Regulamento das Características de Comportamento Térmico dos Edifícios (RCCTE);https://dre.pt/application/file/672550;;
2006;DL;88/2006;23 de maio ;Regula os cursos de especialização tecnológica, formações pós-secundárias não superiores que visam conferir qualificação profissional do nível 4;https://dre.pt/application/file/633197;;
2006;DL;101/2006;6 de junho;Cria a Rede Nacional de Cuidados Continuados Integrados;https://dre.pt/application/file/354005;;
2006;DL;116-A/2006;16 de junho;Procede à criação do Sistema de Certificação Electrónica do Estado - Infra-Estrutura de Chaves Públicas e designa a Autoridade Nacional de Segurança como autoridade credenciadora nacional;https://dre.pt/application/file/548174;;
2006;DL;124/2006;28 de junho;Estabelece as medidas e ações a desenvolver no âmbito do Sistema Nacional de Defesa da Floresta contra Incêndios;http://dre.pt/pdf1sdip/2006/06/123A00/45864599.pdf;;
2006;DL;125/2006;29 de junho;Cria a «empresa on-line», através de um regime especial de constituição on-line de sociedades comerciais e civis sob forma comercial, e cria a «marca na hora», alterando o regime do Registo Nacional de Pessoas Colectivas, o Regulamento Emolumentar dos Registos e do Notariado, o Decreto-Lei n.º 8-B/2002, de 15 de Janeiro, e o Decreto-Lei n.º 111/2005, de 8 de Julho;https://dre.pt/application/file/356444;;
2006;DL;134/2006;25 de julho;Cria o Sistema Integrado de Operações de Proteção e Socorro (SIOPS);http://dre.pt/pdf1sdip/2006/07/14200/52315237.pdf;;
2006;DL;138/2006;26 de julho;Quarta alteração ao Decreto-Lei n.º 83/2000, de 11 de Maio, que aprova o regime legal da concessão e emissão do passaporte electrónico português;https://dre.pt/application/file/539276;;
2006;DL;139/2006;26 de julho;Primeira alteração ao Decreto-Lei n.º 86/2000, de 12 de Maio, que regula a organização e o funcionamento do sistema de informação do passaporte electrónico português;https://dre.pt/application/file/539172;;
2006;DL;142/2006;27 de julho;Cria o Sistema Nacional de Informação e Registo Animal (SNIRA), que estabelece as regras para identificação, registo e circulação dos animais das espécies bovina, ovina, caprina, suína e equídeos, bem como o regime jurídico dos centros de agrupamento, comerciantes e transportadores e as normas de funcionamento do sistema de recolha de cadáveres na exploração (SIRCA), revogando o Decreto-Lei n.º 338/89, de 24 de Agosto;http://dre.pt/pdf1sdip/2006/07/14400/53575369.pdf;;
2006;DL;146/2006;31 de julho;Transpõe para a ordem jurídica interna a Diretiva n.º 2002/49/CE, do Parlamento Europeu e do Conselho, de 25 de Junho, relativa à avaliação e gestão do ruído ambiente;https://dre.pt/application/file/539328;;
2006;DL;167/2006;16 de agosto;Altera o Decreto-Lei n.º 151-A/2000 de 20 de Julho, que estabelece o regime aplicável ao licenciamento de redes e estações de radiocomunicações e à fiscalização da instalação das referidas estações e da utilização do espectro;https://dre.pt/application/file/538769;;
2006;DL;176/2006;30 de agosto;Estabelece o regime jurídico dos medicamentos de uso humano, transpondo a Diretiva n.º 2001/83/CE, do Parlamento Europeu e do Conselho, de 6 de Novembro, que estabelece um código comunitário relativo aos medicamentos para uso humano, bem como as Diretivas n.os 2002/98/CE, do Parlamento Europeu e do Conselho, de 27 de Janeiro, 2003/63/CE, da Comissão, de 25 de Junho, e 2004/24/CE e 2004/27/CE, ambas do Parlamento Europeu e do Conselho, de 31 de Março, e altera o Decreto-Lei n.º 495/99, de 18 de Novembro;https://dre.pt/application/file/540322;;
2006;DL;76/2006;30 de agosto;Estabelece o regime jurídico dos medicamentos de uso humano, transpondo a Diretiva n.º2001/83/CE, que estabelece um código comunitário relativo aos medicamentos para uso humano;https://dre.pt/application/file/540322;;
2006;DL;178/2006;5 de setembro;Aprova o regime geral da gestão de resíduos, transpondo para a ordem jurídica interna a Diretiva n.º 2006/12/CE, do Parlamento Europeu e do Conselho, de 5 de Abril, e a Diretiva n.º 91/689/CEE, do Conselho, de 12 de Dezembro;https://dre.pt/application/file/539951;;
2006;DL;180/2006;6 de setembro;Quinta alteração ao Decreto-Lei n.º 93/90, de 19 de Março, que define o regime jurídico da Reserva Ecológica Nacional;https://dre.pt/application/file/539914;;
2006;DL;181/2006;6 de setembro;Estabelece o regime de limitação das emissões de compostos orgânicos voláteis (COV) resultantes da utilização de solventes orgânicos em determinadas tintas e vernizes e em produtos de retoque de veículos;https://dre.pt/application/file/539915;;
2006;DL;192/2006;26 de setembro ;Transpõe para a ordem jurídica interna a Diretiva n.º 2004/22/CE, do Parlamento Europeu e do Conselho, de 31 de Março, relativa aos instrumentos de medição;https://dre.pt/application/file/a/541521;;
2006;DL;200/2006;25 de outubro;Estabelece o enquadramento procedimental relativo à extinção, fusão e reestruturação de serviços da Administração Pública e à racionalização de efectivos;http://www.itn.pt/pt/leis/206IA06-DL200.pdf;;
2006;DL;202/2006;27 de outubro;Aprova a Lei Orgânica da Presidência do Conselho de Ministros;https://dre.pt/application/file/545676;;
