Ano do diploma;Tipo de diploma;N.º do diploma;Data do diploma;Título / âmbito do diploma;Link;;
2012;Portaria;344/2012;26 de outubro;Estabelece os termos e os procedimentos da reavaliação dos escalões de rendimentos e da composição do agregado familiar, sempre que se verifique alteração daqueles elementos, de que depende a determinação dos montantes do abono de família para crianças e jovens;https://dre.pt/application/file/192494;;
2012;Portaria;352/2012;30 de outubro;Regulamenta o procedimento de licenciamento e de atribuição de alvará a novas farmácias, bem como a transferência da localização de farmácias e o averbamento no alvará, e revoga a Portaria n.º 1430/2007, de 2 de novembro;http://dre.pt/pdf1sdip/2012/10/21000/0625306259.pdf;;
2012;Portaria;411/2012;14 de dezembro;Primeira alteração à Portaria n.º 262/2011, de 31 de agosto que estabelece as normas reguladoras das condições de instalação e funcionamento das creches;http://dre.pt/pdf1sdip/2012/12/24200/0706407065.pdf;;
2012;Portaria;423/2012;28 de dezembro;Aprovado os estatutos do Instituto Nacional de Estatística, I.P.;https://dre.pt/pdf1sdip/2012/12/25100/0727407277.pdf;;
2012;Portaria ;67/2012;21 de março ;Define as condições de organização, funcionamento e instalação das estruturas residenciais para pessoas idosas;https://dre.pt/application/file/553791;;
2012;Deliberação do Conselho Superior de Magistratura;1868/2012;5 de dezembro ;Regulamento das inspeções judiciais;https://dre.pt/application/file/a/2984935;;
2012;Regulamento (UE);1151/2012;21 de novembro;Relativo aos regimes de qualidade dos produtos agrícolas e dos géneros alimentícios;http://eur-lex.europa.eu/LexUriServ/LexUriServ.do?uri=OJ:L:2012:343:0001:0029:pt:PDF;;
2012;Regulamento de Execução (UE);520/2012;19 de junho;Relativo à realização das atividades de farmacovigilância previstas no Regulamento (CE) n.o 726/2004 do Parlamento Europeu e do Conselho e na Diretiva 2001/83/CE do Parlamento Europeu e do Conselho (Texto relevante para efeitos do EE.;http://ec.europa.eu/health/files/eudralex/vol-1/reg_2012_520/reg_2012_520_pt.pdf;;
2012;RCM;12/2012;7 de fevereiro;Aprova o plano global estratégico de racionalização e redução de custos com as TIC na Administração Pública, apresentado pelo Grupo de Projeto para as Tecnologias de Informação e Comunicação (GPTIC);https://dre.pt/application/file/543636;;
2012;RCM;42/2012;13 de abril;Cria a Comissão Instaladora do Centro Nacional de Cibersegurança;https://dre.pt/application/file/552594;;
2012;RCM;91/2012;8 de novembro;"Aprova o Regulamento Nacional de Interoperabilidade Digital
";https://dre.pt/application/file/191922;;
2012;RCM;112/2012;31 de dezembro;Aprova a Agenda Portugal Digital;https://dre.pt/application/file/189473;;
2013;NP EN ISO/IEC;17020/2013;;Avaliação da conformidade: requisitos para o funcionamento de diferentes tipos de organismos de inspeção ;http://www1.ipq.pt/PT/site/clientes/pages/Norma.aspx?docId=IPQDOC-185-173170;;
2013;Declaração de retificação;3/2013;18 de janeiro;Retifica o Decreto-Lei n.º 249/2012, de 21 de novembro, do Ministério da Administração Interna, que procede à segunda alteração ao Decreto-Lei n.º 241/2007, de 21 de junho, que define o regime jurídico aplicável aos bombeiros portugueses no território continental, públicado no Diário da República, n.º 225, 1.ª série, de 21 de novembro de 2012;https://dre.pt/application/file/256958;;
2013;Deliberação do Conselho Superior dos Tribunais Administrativos e Fiscais;2078/2013;4 de novembro;Reformulação dos critérios de classificação das espécies de processos;https://dre.pt/application/file/2770775;;
2013;Despacho;9954/2013;30 de julho;Procede à criação de unidades orgânicas flexíveis nos serviços centrais da Direção-Geral de Reinserção e Serviços Prisionais (DGRSP), e estabelece as respetivas competências.;https://dre.pt/application/file/1740166;;
2013;Despacho;13692/2013;28 de outubro;Orientação Política para a Ciberdefesa.;https://dre.pt/application/file/3295546;;
2013;DL;1/2013;7 de janeiro;Procede à instalação e à definição das regras do funcionamento do Balcão Nacional do Arrendamento e do procedimento especial de despejo;https://dre.pt/application/file/588757;;
2013;DL;3/2013;10 de janeiro;Determina que durante o ano de 2013 o pagamento do montante adicional das pensões de invalidez, velhice e sobrevivência atribuídas pelo sistema de segurança social, referente ao mês de dezembro, relativamente aos pensionistas cuja soma das pensões seja igual ou superior a (euro) 600, e do subsídio de Natal dos aposentados, reformados e demais pensionistas da Caixa Geral de Aposentações, seja efetuado em duodécimos;https://dre.pt/application/file/588734;;
2013;DL;12/2013;25 de janeiro;Estabelece o regime jurídico de proteção social na eventualidade de desemprego dos trabalhadores independentes com atividade empresarial e dos membros dos órgãos estatutários das pessoas coletivas;https://dre.pt/application/file/256903;;
2013;DL;13/2013;25 de janeiro;Altera os regimes jurídicos de proteção social no desemprego, morte, dependência, rendimento social de inserção, complemento solidário para idosos e complemento por cônjuge a cargo, do sistema de segurança social;https://dre.pt/application/file/256904;;
2013;DL;41609;25 de janeiro;Estabelece o regime jurídico de proteção social na eventualidade de desemprego dos trabalhadores independentes com atividade empresarial e dos membros dos órgãos estatutários das pessoas coletivas;https://dre.pt/application/file/256903;;
2013;DL;13/2013;25 de janeiro;Altera os regimes jurídicos de proteção social no desemprego, morte, dependência, rendimento social de inserção, complemento solidário para idosos e complemento por cônjuge a cargo, do sistema de segurança social;https://dre.pt/application/file/256904;;
2013;DL;14/2013;28 de janeiro;No uso da autorização legislativa concedida pela Lei n.º 64-B/2011, de 30 de dezembro, procede à sistematização e harmonização da legislação referente ao Número de Identificação Fiscal e revoga o Decreto-Lei n.º 463/79, de 30 de novembro;https://dre.pt/application/file/256919;;
2013;DL; 20/2013;14 de fevereiro;Procede à sétima alteração ao Decreto-Lei n.º 176/2006, de 30 de agosto, que estabelece o regime jurídico dos medicamentos de uso humano, transpondo a Diretiva n.º 2010/84/UE do Parlamento Europeu e do Conselho, de 15 de dezembro de 2010;https://dre.pt/application/file/258623;;
2013;DL;22/2013;15 de fevereiro;Estabelece as regras e os procedimentos a adotar pelo Instituto de Financiamento da Agricultura e Pescas, I.P., no processo de delegação de tarefas e competências necessárias à execução da função de pagamento das ajudas e dos apoios financeiros, designadamente no âmbito do Fundo Europeu Agrícola de Garantia, e do Fundo Europeu Agrícola de Desenvolvimento Rural;https://dre.pt/application/file/258601;;
2013;DL;28/2013;19 de fevereiro;Define o regime jurídico de contratação de doutorados no âmbito do Programa Investigador FCT.;https://www.fct.pt/apoios/contratacaodoutorados/investigador-fct/docs/DL_InvestigadorFCT.pdf;;
2013;DL;34/2013;27 de fevereiro;Procede à segunda alteração ao Decreto-Lei n.º 112/2011, de 29 de novembro, que aprova o regime da formação do preço dos medicamentos sujeitos a receita médica e dos medicamentos não sujeitos a receita médica comparticipados, e estabelece um mecanismo de definição dos preços dos medicamentos sujeitos a receita médica que não tenham sido objeto de avaliação prévia para efeitos de aquisição pelos hospitais do Serviço Nacional de Saúde, nem de decisão de comparticipação;https://dre.pt/application/file/259158;;
2013;DL;38/2013;15 de março;Regula o regime de comércio de licenças de emissão de gases com efeito de estufa a partir de 2013;https://dre.pt/application/file/259808;;
2013;DL;45/2013;5 de abril;Estabelece as medidas específicas de apoio à preparação e participação internacional das seleções ou outras representações desportivas nacionai;https://dre.pt/application/file/259980;;
2013;DL;152/2013;11 de abril;Aprova o Estatuto do Ensino Particular e Cooperativo de nível não superior;https://dre.pt/application/file/504894;;
2013;DL;55/2013;17 de abril;Procede à integração na Fundação para a Ciência e a Tecnologia da Fundação para a Computação Científica Nacional - FCCN.;https://dre.pt/application/file/260332;;
2013;DL;81/2013;14 de junho;Aprova o novo regime de exercício da atividade pecuária e altera os Decretos-Leis n.º 202/2004, de 18 de agosto, e n.º 142/2006, de 27 de julho;http://dre.pt/pdf1sdip/2013/06/11300/0330403329.pdf;;
2013;DL; 89/2013;9 de julho;Procede à alteração (terceria alteração) do Estatuto do Bolseiro de Investigação, aprovado em anexo à Lei n.º 40/2004, de 18 de agosto.;https://dre.pt/application/file/497905;;
2013;DL;91/2013;10 de julho;Procede à primeira alteração ao Decreto-Lei n.º 139/2012, de 5 de julho, que estabelece os princípios orientadores da organização e da gestão dos currículos dos ensinos básico e ;https://dre.pt/application/file/497898;;
2013;DL;96/2013;19 de julho;Estabelece o regime jurídico a que estão sujeitas, no território continental, as ações de arborização e rearborização com recurso a espécies florestais;https://dre.pt/application/file/497960;;
2013;DL;115/2013;7 de agosto;Procede à terceira alteração ao Decreto-Lei n.º 74/2006, de 24 de março, que aprova o regime jurídico dos graus académicos e diplomas do ensino superior, em desenvolvimento do disposto nos artigos 11.º a 17.º da Lei n.º 46/86, de 14 de outubro (Lei de Bases do Sistema Educativo);https://dre.pt/application/file/498425;;
2013;DL;118/2013;20 de agosto;Aprova o Sistema de Certificação Energética dos Edifícios, o Regulamento de Desempenho Energético dos Edifícios de Habitação e o Regulamento de Desempenho Energético dos Edifícios de Comércio e Serviços, e transpõe a Diretiva n.º 2010/31/UE, do Parlamento Europeu e do Conselho, de 19 de maio de 2010, relativa ao desempenho energético dos edifícios;https://dre.pt/application/file/499375;;
2013;DL;122/2013;26 de agosto;Procede à terceira alteração ao Decreto-Lei n.º 272/2001, de 13 de outubro, que determina a atribuição e transferência de competências relativas a um conjunto de processos especiais dos tribunais judiciais para o Ministério Público e para as conservatórias de registo civil, regulando os correspondentes procedimentos;https://dre.pt/application/file/499455;;
2013;DL;124/2013;30 de agosto;Procede à regulamentação da Lei n.º 55/2012, de 6 de setembro, no que respeita às medidas de apoio ao desenvolvimento e proteção das atividades cinematográficas e audiovisuais, às obrigações de investimento e ao registo de obras e empresas cinematográficas e audiovisuais;https://dre.pt/application/file/499582;;
2013;DL;127/2013;30 de agosto;Estabelece o regime de emissões industriais aplicável à prevenção e ao controlo integrados da poluição, bem como as regras destinadas a evitar e ou reduzir as emissões para o ar, a água e o solo e a produção de resíduos, transpondo a Diretiva n.º2010/75/UE, do Parlamento Europeu e do Conselho, de 24 de novembro de 2010, relativa às emissões industriais (prevenção e controlo integrados da poluição);https://dre.pt/application/file/499584;;
2013;DL;131/2013;11 de setembro;Procede à segunda alteração ao Decreto-Lei n.º 290/2009, de 12 de outubro, alargando a entidades de natureza pública alguns dos apoios para o desenvolvimento das políticas de emprego e apoio à qualificação das pessoas com deficiência e incapacidade;https://dre.pt/application/file/499958;;
2013;DL;133/2013;3 de outubro;Aprova o novo regime jurídico do sector público empresarial (No uso da autorização legislativa concedida pela Lei n.º 18/2013, de 18 de fevereiro);https://dre.pt/application/file/500153;;
2013;DL;139/2013;9 de outubro;Estabelece o regime jurídico das convenções que tenham por objeto a realização de prestações de saúde aos utentes do Serviço Nacional de Saúde no âmbito da rede nacional de prestação de cuidados de saúde;https://dre.pt/application/file/500090;;
2013;DL;287/2013;12 de novembro;No uso da autorização legislativa concedida pela Lei n.º 26/2003, de 30 de Julho, aprova o Código do Imposto Municipal sobre Imóveis e o Código do Imposto Municipal sobre as Transmissões Onerosas de Imóveis, altera o Código do Imposto do Selo, altera o Estatuto dos Benefícios Fiscais e os Códigos do IRS e do IRC e revoga o Código da Contribuição Predial e do Imposto sobre a Indústria Agrícola, o Código da Contribuição Autárquica e o Código do Imposto Municipal de Sisa e do Imposto sobre as Sucessões e Doações;https://dre.pt/application/file/447273;;
2013;DL;133/2013;3 de outubro ;Aprova o novo regime jurídico do sector público empresarial;https://dre.pt/application/file/a/500153;;
2013;DL ;151-B/2013;31 de outubro;Estabelece o regime jurídico da avaliação de impacto ambiental (AIA) dos projetos públicos e privados suscetíveis de produzirem efeitos significativos no ambiente, transpondo a Diretiva n.º 2011/92/UE, do Parlamento Europeu e do Conselho, de 13 de dezembro, relativa à avaliação dos efeitos de determinados projetos públicos e privados no ambiente;https://dre.pt/application/file/513900;;
2013;DL ;167-E/2013;31 de dezembro ;Altera o regime jurídico de proteção social nas eventualidades de invalidez e velhice do regime geral de segurança social;https://dre.pt/application/file/164489;;
2013;Lei;2/2013;10 de janeiro;Estabelece o regime jurídico de criação, organização e funcionamento das associações públicas profissionais;https://dre.pt/application/file/588732;;
2013;Lei;5/2013;22 de janeiro;Simplifica o acesso à atividade transitária e ao transporte em táxi, através da eliminação dos requisitos de idoneidade e de capacidade técnica ou profissional dos responsáveis das empresas, e ao transporte coletivo de crianças, através da eliminação dos requisitos de capacidade técnica ou profissional dos responsáveis das empresas,;https://dre.pt/application/file/257093;;
2013;Lei;11-A/2013;28 de janeiro;Reorganização administrativa do território das freguesias;https://dre.pt/application/file/373764;;
2013;Lei;12/2013;29 de janeiro;Primeira alteração, por apreciação parlamentar, ao Decreto-Lei n.º 202/2012, de 27 de agosto, que procede à primeira alteração ao Estatuto do Bolseiro de Investigação, aprovado em anexo à Lei n.º 40/2004, de 18 de agosto;https://dre.pt/application/file/258183;;
2013;Lei;15/2013;8 de fevereiro;Estabelece o regime jurídico a que fica sujeita a atividade de mediação imobiliária, conformando-o com a disciplina constante do Decreto-Lei n.º 92/2010, de 26 de julho, que transpôs para a ordem jurídica interna a Diretiva n.º 2006/123/CE, do Parlamento Europeu e do Conselho, de 12 de dezembro de 2006, relativa aos serviços no mercado interno;https://dre.pt/application/file/257723;;
2013;Lei;21/2013;21 de fevereiro;Procede à terceira alteração ao Código da Execução das Penas e Medidas Privativas de Liberdade, aprovado pela Lei n.º 115/2009, de 12 de outubro;https://dre.pt/application/file/258411;;
2013;Lei;23/2013;5 de março;Aprova o regime jurídico do processo de inventário, altera o Código Civil, o Código do Registo Predial, o Código do Registo Civil e o Código de Processo Civil;https://dre.pt/application/file/259284;;
2013;Lei;24/2013;20 de março;Aprova o regime jurídico aplicável ao mergulho recreativo em todo o território nacional, em conformidade com o Decreto-Lei n.º 92/2010, de 26 de julho, que transpôs a Diretiva n.º 2006/123/CE, do Parlamento Europeu e do Conselho, de 12 de dezembro, relativa aos serviços no mercado interno, com a Lei n.º 9/2009, de 4 de março, que transpôs a Diretiva n.º 2005/36/CE, do Parlamento Europeu e do Conselho, de 7 de setembro, relativa ao reconhecimento das qualificações profissionais, e com o Decreto-Lei n.º 92/2011, de 27 de julho, que cria o Sistema de Regulação de Acesso a Profissões (SRAP);https://dre.pt/application/file/259799;;
2013;Lei;29/2013;19 de abril;Estabelece os princípios gerais aplicáveis à mediação realizada em Portugal, bem como os regimes jurídicos da mediação civil e comercial, dos mediadores e da mediação pública;https://dre.pt/application/file/260307;;
2013;Lei;34/2013;15 de maio;Estabelece o regime do exercício da atividade de segurança privada e procede à primeira alteração à Lei n.º 49/2008, de 27 de agosto (Lei de Organização da Investigação Criminal);http://dre.pt/pdf1sdip/2013/05/09400/0292102942.pdf;;
2013;Lei;36/2013;12 de junho;Aprova o regime de garantia de qualidade e segurança dos órgãos de origem humana destinados a transplantação no corpo humano, de forma a assegurar um elevado nível de proteção da saúde humana, transpondo a Diretiva n.º 2010/53/UE, do Parlamento Europeu e do Conselho, de 7 de julho, relativa a normas de qualidade e segurança dos órgãos humanos destinados a transplantação;https://dre.pt/application/file/496776;;
2013;Lei;40/2013;25 de junho;Aprova a lei de organização e funcionamento do conselho de fiscalização da base de dados de perfis de ADN e procede à primeira alteração à Lei n.º 5/2008, de 12 de fevereiro;https://dre.pt/application/file/497355;;
2013;Lei;41/2013;26 de junho;Aprova o Código de Processo Civil;https://dre.pt/application/file/497344;;
2013;Lei;52/2013;25 de julho;Procede à segunda alteração à Lei n.º 39/2009, de 30 de julho, que estabelece o regime jurídico do combate à violência, ao racismo, à xenofobia e à intolerância nos espetáculos desportivos, de forma a possibilitar a realização dos mesmos com segurança;https://dre.pt/application/file/498894;;
2013;Lei;53/2013;26 de julho;Altera o Decreto-Lei n.º 442-A/88, de 30 de novembro, que aprova o Código do Imposto sobre o Rendimento das Pessoas Singulares, clarificando o enquadramento fiscal das compensações e subsídios, referentes à atividade voluntária, postos à disposição dos bombeiros pela Autoridade Nacional de Proteção Civil e pagos pelas respetivas entidades detentoras de corpos de bombeiros, no âmbito do dispositivo especial de combate a incêndios, bem como das bolsas atribuídas aos praticantes de alto rendimento desportivo, pelo Comité Paralímpico de Portugal, no âmbito do contrato-programa de preparação para os Jogos Surdolímpicos, e dos respetivos prémios atribuídos por classificações relevantes obtidas em provas desportivas de elevado prestígio e nível competitivo;https://dre.pt/application/file/498671;;
2013;Lei;54/2013;31 de julho;Primeira alteração à Lei n.º 78/2001, de 13 de julho (Lei de organização, competência e funcionamento dos julgados de paz), aperfeiçoando alguns aspetos de organização e funcionamento dos julgados de paz;https://dre.pt/application/file/498617;;
2013;Lei;61/2013;23 de agosto;Estabelece o regime aplicável aos grafitos, afixações, picotagem e outras formas de alteração, ainda que temporária, das caraterísticas originais de superfícies exteriores de edifícios, pavimentos, passeios, muros e outras infraestruturas;http://dre.pt/pdf1sdip/2013/08/16200/0509005092.pdf;;
2013;Lei;62/2013;26 de agosto;Lei da Organização do Sistema Judiciário;https://dre.pt/application/file/499452;;
2013;Lei;70/2013;30 de agosto ;Estabelece os regimes jurídicos do fundo de compensação do trabalho, do mecanismo equivalente e do fundo de garantia de compensação do trabalho;https://dre.pt/application/file/499585;;
2013;Lei;72/2013;3 de setembro;Décima terceira alteração ao Código da Estrada, aprovado pelo Decreto-Lei n.º 114/94, de 3 de maio, e primeira alteração ao Decreto-Lei n.º 44/2005, de 23 de fevereiro;https://dre.pt/pdf1sdip/2013/09/16900/0544605499.pdf;;
2013;Lei;73/2013;3 de setembro;"Estabelece o regime financeiro das autarquias locais e das
entidades intermunicipais";http://dre.pt/pdf1sdip/2013/09/16900/0549905519.pdf;;
2013;Lei;75/2013;12 de setembro;Estabelece o regime jurídico das autarquias locais, aprova o estatuto das entidades intermunicipais, estabelece o regime jurídico da transferência de competências do Estado para as autarquias locais e para as entidades intermunicipais e aprova o regime jurídico do associativismo autárquico;https://dre.pt/pdf1sdip/2013/09/17600/0568805724.pdf;;
2013;Lei;80/2013;28 de novembro;Estabelece o regime jurídico da requalificação de trabalhadores em funções públicas visando a melhor afetação dos recursos humanos da Administração Pública, e procede à nona alteração à Lei n.º 12-A/2008, de 27 de fevereiro, à quinta alteração ao Decreto-Lei n.º 74/70, de 2 de março, à décima segunda alteração ao Decreto-Lei n.º 139-A/90, de 28 de abril, à terceira alteração ao Decreto-Lei n.º 209/2009, de 3 de setembro, e à primeira alteração ao Decreto-Lei n.º 132/2012, de 27 de junho, revogando a Lei n.º 53/2006, de 7 de dezembro;https://dre.pt/application/file/484298;;
2013;Lei;83/2013;9 de dezembro;Procede à segunda alteração à Lei n.º 66-B/2012, de 31 de dezembro (Orçamento do Estado para 2013), à alteração do Decreto-Lei n.º 215/89, de 1 de julho (Estatuto dos Benefícios Fiscais), e à terceira alteração ao Decreto-Lei n.º 193/2005, de 7 de novembro (Regime Especial de Tributação dos Rendimentos de Valores Mobiliários Representativos de Dívida);https://dre.pt/application/file/484065;;
2013;Lei;83-A/2013;30 de dezembro; Bases gerais do sistema de segurança social;https://dre.pt/application/file/423711;;
2013;Lei ;10/2013;28 de janeiro ;Procede à 5.ª alteração da Lei n.º 23/96, de 26 de julho, à 3.ª alteração da Lei n.º 24/96, de 31 de julho, e à 7.ª alteração da Lei n.º 5/2004, de 10 de fevereiro, no sentido de se atribuir maior eficácia à proteção do consumidor;https://dre.pt/application/file/a/256922;;
2013;n/a;s/nº;maio de 2013;"Plano Nacional de Saúde 2012-2016
";http://1nj5ms2lli5hdggbe3mm7ms5.wpengine.netdna-cdn.com/files/2013/05/Versao-resumo.pdf;;
2013;Norma Operacional Permanente ANPC;3101/2013;4 de junho;Atualização da tabela de classificação de ocorrências.;http://www.bombeiros.pt/Arquivo1/NOP's/NOP%203101-2009%20-%20Classifica%E7%E3o%20de%20Ocorr%EAncias.pdf;;
2013;Portaria;10/2013; 11 de janeiro;Quinta alteração à Portaria n.º 1230/2006, de 15 de novembro que cria os programas de apoio financeiro ao associativismo jovem (PAJ, PAI e PAE) e aprova o respetivo Regulamento;https://dre.pt/application/file/588746;;
2013;Portaria;19/2013;21 de janeiro;Aprova os Estatutos do Instituto Nacional de Medicina Legal e Ciências Forenses, I.P. e revoga a Portaria n.º 522/20;https://dre.pt/application/file/257080;;
2013;Portaria;38/2013;30 de Janeiro;Estabelece as condições de instalação e funcionamento do serviço de apoio domiciliário, e revoga o Despacho Normativo n.º 62/99, de 12 de novembro;http://dre.pt/pdf1sdip/2013/01/02100/0060500608.pdf;;
2013;Portaria;248/2013;5 de agosto;Aprova o regulamento de notificação obrigatória de doenças transmissíveis e outros riscos em saúde pública;https://dre.pt/application/file/a/498972;;
2013;Portaria;75/2013;18 de fevereiro;Regulamenta o disposto nos n.º 2 do artigo 9.º e n.º 3 do artigo 22.º, ambos da Lei-Quadro das Fundações (Lei n.º 24/2012, de 9 de julho);https://dre.pt/application/file/258611;;
2013;Portaria;95/2013;4 de março;Aprova o Regulamento do Sistema Integrado de Referenciação e de Gestão do Acesso à Primeira Consulta de Especialidade Hospitalar nas instituições do Serviço Nacional de Saúde e revoga a Portaria n.º 615/2008, de 11 de julho;https://dre.pt/application/file/259280;;
2013;Portaria;96/2013;4 de março;Estabelece as condições de instalação e funcionamento dos estabelecimentos de apoio social - Centro de Noite;http://dre.pt/pdf1sdip/2013/03/04400/0119101193.pdf;;
2013;Portaria;124-A/2013;27 de março;Estabelece as normas aplicáveis à atribuição do cartão nacional de dador de sangue, bem como ao reconhecimento público pela dádiva regular de sangue;https://dre.pt/application/file/479314;;
2013;Portaria;139/2013;2 de abril;Estabelece a forma de intervenção, organização e funcionamento dos Centros de Apoio Familiar e Aconselhamento Parental;https://dre.pt/application/file/259866;;
2013;Portaria;204-B/2013;18 de junho;Cria a medida Estágios Emprego;https://dre.pt/application/file/545966;;
2013;Portaria;208/2013;26 de junho;Primeira alteração à Portaria n.º 851/2010, de 6 de setembro, que regula o sistema de certificação de entidades formadoras previsto no n.º 2 do artigo 16.º do Decreto-Lei n.º 396/2007, de 31 de dezembro;https://dre.pt/application/file/497342;;
2013;Portaria;220/2013;4 de julho;Primeira alteração à Portaria n.º 337/2004, de 31 de março, que estabelece o novo regime jurídico de proteção social na eventualidade doença, no âmbito do subsistema previdencial de segurança social;https://dre.pt/application/file/497545;;
2013;Portaria;239/2013;25 de julho;Primeira alteração à Portaria n.º 1200/2010, de 29 de novembro que estabelece as normas regulamentares, os modelos de requerimento e as taxas a que estão sujeitos os pedidos de instrução para aquisição ou reconhecimento da qualidade de agente oficial da propriedade industrial e aprova o regulamento das respetivas provas de aptidão;https://dre.pt/application/file/498899;;
